N50643,weather,weathertopstories,"A little snow causes a big mess, more than 100 crashes on Minnesota roads","A snowfall of a mere one-tenth of an inch caused way more than its share of damaged cars and rattled drivers early Saturday, with 118 crashes reported between 6 a.m. and 11:30 a.m., according to the Minnesota State Patrol. Another 22 vehicles spun out or slid off the slick roads, said State Patrol spokesman Lt. Gordon Shank. No weather-related fatalities were reported. Although 18 people were ...",https://assets.msn.com/labs/mind/AAJJZkz.html,"[{""Label"": ""Minnesota"", ""Type"": ""G"", ""WikidataId"": ""Q1527"", ""Confidence"": 0.986, ""OccurrenceOffsets"": [58], ""SurfaceForms"": [""Minnesota""]}]","[{""Label"": ""Minnesota State Patrol"", ""Type"": ""O"", ""WikidataId"": ""Q6868552"", ""Confidence"": 1.0, ""OccurrenceOffsets"": [199, 286], ""SurfaceForms"": [""Minnesota State Patrol"", ""State Patrol""]}]"
N60723,news,newsworld,Extinction Rebellion wins court challenge against London police,A blanket ban against the climate change activist's 10-day demonstrations across London in October was ruled unlawful.,https://assets.msn.com/labs/mind/AAJWD7d.html,"[{""Label"": ""Extinction Rebellion"", ""Type"": ""N"", ""WikidataId"": ""Q58819597"", ""Confidence"": 1.0, ""OccurrenceOffsets"": [0], ""SurfaceForms"": [""Extinction Rebellion""]}]","[{""Label"": ""London"", ""Type"": ""G"", ""WikidataId"": ""Q84"", ""Confidence"": 0.98, ""OccurrenceOffsets"": [81], ""SurfaceForms"": [""London""]}]"
N63175,sports,basketball_nba,"LA rivalry takes on new meaning for fans as Lakers, Clippers in hunt for NBA championship","NBA Finals MVP Kawhi Leonard and other Clippers say they are used to taunts and booing from Lakers fans, who are ""like a religion"" in Tinseltown.",https://assets.msn.com/labs/mind/AAJaBQj.html,"[{""Label"": ""Los Angeles Clippers"", ""Type"": ""O"", ""WikidataId"": ""Q976396"", ""Confidence"": 1.0, ""OccurrenceOffsets"": [52], ""SurfaceForms"": [""Clippers""]}, {""Label"": ""National Basketball Association"", ""Type"": ""O"", ""WikidataId"": ""Q155223"", ""Confidence"": 1.0, ""OccurrenceOffsets"": [73], ""SurfaceForms"": [""NBA""]}]","[{""Label"": ""Los Angeles Clippers"", ""Type"": ""O"", ""WikidataId"": ""Q976396"", ""Confidence"": 1.0, ""OccurrenceOffsets"": [39], ""SurfaceForms"": [""Clippers""]}, {""Label"": ""Kawhi Leonard"", ""Type"": ""P"", ""WikidataId"": ""Q926248"", ""Confidence"": 1.0, ""OccurrenceOffsets"": [15], ""SurfaceForms"": [""Kawhi Leonard""]}, {""Label"": ""NBA Finals Most Valuable Player Award"", ""Type"": ""N"", ""WikidataId"": ""Q739499"", ""Confidence"": 1.0, ""OccurrenceOffsets"": [0], ""SurfaceForms"": [""NBA Finals MVP""]}]"
N282,news,newsscienceandtechnology,The $400 JBL Link 500 smart speaker is on sale for $150,"Equipped with Bluetooth, Wi-Fi, Chromecast and Google Assistant, it's powerful enough for even your largest rooms.",https://assets.msn.com/labs/mind/AAJwfTh.html,[],"[{""Label"": ""Google Assistant"", ""Type"": ""W"", ""WikidataId"": ""Q25025241"", ""Confidence"": 1.0, ""OccurrenceOffsets"": [47], ""SurfaceForms"": [""Google Assistant""]}, {""Label"": ""Chromecast"", ""Type"": ""J"", ""WikidataId"": ""Q14253532"", ""Confidence"": 1.0, ""OccurrenceOffsets"": [32], ""SurfaceForms"": [""Chromecast""]}, {""Label"": ""Bluetooth"", ""Type"": ""U"", ""WikidataId"": ""Q39531"", ""Confidence"": 1.0, ""OccurrenceOffsets"": [14], ""SurfaceForms"": [""Bluetooth""]}, {""Label"": ""Wi-Fi"", ""Type"": ""J"", ""WikidataId"": ""Q29643"", ""Confidence"": 1.0, ""OccurrenceOffsets"": [25], ""SurfaceForms"": [""Wi-Fi""]}]"
N33434,video,news,Olympian Shawn Johnson shares big pregnancy news,"Shawn Johnson and her husband, Andrew East, have been taking viewers through the highs and lows of her pregnancy in a vlog that has captured the hearts of thousands online.",https://assets.msn.com/labs/mind/AAECmkw.html,"[{""Label"": ""Shawn Johnson East"", ""Type"": ""P"", ""WikidataId"": ""Q229044"", ""Confidence"": 1.0, ""OccurrenceOffsets"": [9], ""SurfaceForms"": [""Shawn Johnson""]}, {""Label"": ""Olympic Games"", ""Type"": ""U"", ""WikidataId"": ""Q5389"", ""Confidence"": 0.971, ""OccurrenceOffsets"": [0], ""SurfaceForms"": [""Olympian""]}]","[{""Label"": ""Shawn Johnson East"", ""Type"": ""P"", ""WikidataId"": ""Q229044"", ""Confidence"": 1.0, ""OccurrenceOffsets"": [0], ""SurfaceForms"": [""Shawn Johnson""]}, {""Label"": ""Andrew East"", ""Type"": ""P"", ""WikidataId"": ""Q19864263"", ""Confidence"": 1.0, ""OccurrenceOffsets"": [31], ""SurfaceForms"": [""Andrew East""]}]"
N8795,lifestyle,shop-all,5 Things You Probably Shouldn't Be Buying from Costco,"Bigger isn't always better, and some items sell for way cheaper at the supermarket than the warehouse.",https://assets.msn.com/labs/mind/AABmnFz.html,"[{""Label"": ""Costco"", ""Type"": ""O"", ""WikidataId"": ""Q715583"", ""Confidence"": 1.0, ""OccurrenceOffsets"": [47], ""SurfaceForms"": [""Costco""]}, {""Label"": ""English modal verbs"", ""Type"": ""C"", ""WikidataId"": ""Q1624317"", ""Confidence"": 1.0, ""OccurrenceOffsets"": [22], ""SurfaceForms"": [""Shouldn't""]}]",[]
N43647,news,newsphotos,POWER RANKING: Here's who has the best chance of becoming the 2020 Democratic presidential nominee,We've combined Insider polling and results of Morning Consult's daily survey to create a weekly power ranking of the potential 2020 candidates.,https://assets.msn.com/labs/mind/AAAKxi7.html,[],"[{""Label"": ""Insider Inc."", ""Type"": ""N"", ""WikidataId"": ""Q55669360"", ""Confidence"": 0.946, ""OccurrenceOffsets"": [15], ""SurfaceForms"": [""Insider""]}, {""Label"": ""Morning Consult"", ""Type"": ""O"", ""WikidataId"": ""Q28401695"", ""Confidence"": 1.0, ""OccurrenceOffsets"": [46], ""SurfaceForms"": [""Morning Consult""]}]"
N40690,lifestyle,lifestylemindandsoul,How to Teach Kids About Mindfulness,"With increased screen time, it's more important now than ever before.",https://assets.msn.com/labs/mind/AADm8Xz.html,[],[]
N41835,news,newsworld,Today in History: November 2,,https://assets.msn.com/labs/mind/AAJwpBS.html,[],[]
